"places_url_link","places_url_place","places_url_reviews_name","places_url_reviews_title","places_url_reviews_title_url","places_url_reviews_date","places_url_reviews_comment"
"https://www.tripadvisor.com/Attraction_Review-g60922-d255182-Reviews-Big_Cottonwood_Canyon-Salt_Lake_City_Utah.html","Big Cottonwood Canyon","Elishky","Incredible views!!","https://www.tripadvisor.com/ShowUserReviews-g60922-d255182-r387598060-Big_Cottonwood_Canyon-Salt_Lake_City_Utah.html","Jun 2016 • Couples","This is such a beautiful area! Then, I've never been anywhere in the Rockies or the west that isn't. But this canyon is not overly steep and walking back the half mile trail to see the Donut Falls is a must! It's an easy to moderate hike that should take between 20-40 minutes depending on your speed. Try to park in the upper lot so you don't have an extra 2 miles of walking. Once you reach the falls, prepare to do some dangerous climbing if you actually want to get up to the falls. You WILL get wet if you want to get there as well. But you certainly don't need to to enjoy the beauty of the scenery!"
"https://www.tripadvisor.com/Attraction_Review-g60922-d255182-Reviews-Big_Cottonwood_Canyon-Salt_Lake_City_Utah.html","Big Cottonwood Canyon","captronz","Be nice to Bullwinkle","https://www.tripadvisor.com/ShowUserReviews-g60922-d255182-r387202628-Big_Cottonwood_Canyon-Salt_Lake_City_Utah.html","Jun 2016 • Family","I go up into the Canyons on my Harley a lot during the summer to beat the heat. Big Cottonwood is one of my favorite Canyons to ride and go play in. The run up there is a sweet ride and posses scenic overkill at every turn. You can stop in at Solitude and snoop around. There are great opportunities to mountain bike or disc golf or hike till your legs give out. There are events at Solitude like the Sunday - 8/7/2016 Taste of the Wasatch. Check Solitudes website. If you go to the top at Brighton there is Silver Lake to see with a great Eco path around the lake to take a short hike around. There are other trails off the main one if you wish to hike up further to other mountain lakes to fish and enjoy. You may see Moose up there and some Japanese tourists frantically taking pictures of Moose foraging. I have seen bull and cow moose up there. Keep your distance and don't try to pet them or feed them. Just take pictures and enjoy them ... at a distance. I fired up my bike with Bullwinkle about 150 yards away and that got his attention as his head popped up with that huge rack to see if I was a threat. Their eyesight isn't all that good but he can smell real well. I dropped it into gear and made way for the exit.
Go up, cool off, have fun and enjoy the squirrels and chipmunks also(bring nuts and sunflower seed)."
"https://www.tripadvisor.com/Attraction_Review-g60922-d255182-Reviews-Big_Cottonwood_Canyon-Salt_Lake_City_Utah.html","Big Cottonwood Canyon","caraamcgee","Downhill Run","https://www.tripadvisor.com/ShowUserReviews-g60922-d255182-r387117227-Big_Cottonwood_Canyon-Salt_Lake_City_Utah.html","Jun 2016 • Solo","I participated in a downhill run in Big Cottonwood Canyon. It was a steep decline for 13.1 miles and I was certainly sore for several days, but the view was absolutely worth it. It was absolutely gorgeous. I arrived at Solitude at about 0430 and watched the sun rise while waiting for the start of the run. It was easily one of the most beautiful locations I've found on my quest to run a half marathon on each of the 50 states."
"https://www.tripadvisor.com/Attraction_Review-g60922-d255182-Reviews-Big_Cottonwood_Canyon-Salt_Lake_City_Utah.html","Big Cottonwood Canyon","ptquelet","Amazing Sites! Good Verizon cell service in canyon!","https://www.tripadvisor.com/ShowUserReviews-g60922-d255182-r387112126-Big_Cottonwood_Canyon-Salt_Lake_City_Utah.html","Jun 2016 • Solo","--Amazing drive. Close to Salt Lake City.
--One lane road, but enough room to pull off or pass someone many places.
--Many hiking trails. Several lakes to see at the top.
--Ski resorts up there.
--Great cell service all the way up the canyon! Great plus to use GPS or Google Maps to find your way!"
"https://www.tripadvisor.com/Attraction_Review-g60922-d255182-Reviews-Big_Cottonwood_Canyon-Salt_Lake_City_Utah.html","Big Cottonwood Canyon","Dave H","Beautiful Wasach Canyon","https://www.tripadvisor.com/ShowUserReviews-g60922-d255182-r386985921-Big_Cottonwood_Canyon-Salt_Lake_City_Utah.html","Jun 2016 • Family","The drive up Big Cottonwood Canyon and over the summit to Park City is beautiful and well worth the time."
"https://www.tripadvisor.com/Attraction_Review-g60922-d255182-Reviews-Big_Cottonwood_Canyon-Salt_Lake_City_Utah.html","Big Cottonwood Canyon","Mike F","Mountain biking","https://www.tripadvisor.com/ShowUserReviews-g60922-d255182-r386794482-Big_Cottonwood_Canyon-Salt_Lake_City_Utah.html","May 2016 • Friends","If you want some of the best cross country mountain biking, you have to ride the Crest trail. You can do an out and back starting at the top of the canyon, or you can meet a shuttle and do a one way (mostly downhill from the canyon over to Millcreek canyon). A few of the large
Mountain bike magazines have rated the Crest trail as one of the top trails in the nation. (This review won't even talk about the amazing skiing)"
"https://www.tripadvisor.com/Attraction_Review-g60922-d255182-Reviews-Big_Cottonwood_Canyon-Salt_Lake_City_Utah.html","Big Cottonwood Canyon","Marci H","Beautiful","https://www.tripadvisor.com/ShowUserReviews-g60922-d255182-r386763256-Big_Cottonwood_Canyon-Salt_Lake_City_Utah.html","Jun 2016 • Family","So much to do!!!! There are many hikes ranging from easy to wayyyyy difficult. It's beautiful all year, easy to find and navigate."
"https://www.tripadvisor.com/Attraction_Review-g60922-d255182-Reviews-Big_Cottonwood_Canyon-Salt_Lake_City_Utah.html","Big Cottonwood Canyon","Perthenia","Lovely Escape to the Mountains","https://www.tripadvisor.com/ShowUserReviews-g60922-d255182-r386752694-Big_Cottonwood_Canyon-Salt_Lake_City_Utah.html","Jun 2016 • Family","Big Cottonwood provides a lovely and quick escape from the heat. We went up to see the wildflowers, and although we were a little early for the season, there were several different types of forbs. The parking areas can get busy on the weekends - get there early for hiking/picnicking."
"https://www.tripadvisor.com/Attraction_Review-g60922-d255182-Reviews-Big_Cottonwood_Canyon-Salt_Lake_City_Utah.html","Big Cottonwood Canyon","jorosie1","Beautiful, beautiful...any time of the year!","https://www.tripadvisor.com/ShowUserReviews-g60922-d255182-r386657285-Big_Cottonwood_Canyon-Salt_Lake_City_Utah.html","Jun 2016 • Couples","Big Cottonwood Canyon is one of the most spectacular canyons in Utah. A short 15 minute from SLC center, you enter into an amazing deep canyon with a wonderful river running right next to the road. There are many picnic areas and overnight sites on the way up. Pack up a lunch and explore! There are several trails that take you to waterfalls and beautiful open areas of wild flowers. If you have time, stop at Silver Fork Lodge and have breakfast, lunch or dinner...their patio is amazing! There are 2 ski areas up this canyon...Brighton and Solitude. Both have amazing skiing and great lodges."
"https://www.tripadvisor.com/Attraction_Review-g60922-d255182-Reviews-Big_Cottonwood_Canyon-Salt_Lake_City_Utah.html","Big Cottonwood Canyon","Karin K","gorgeous canyon","https://www.tripadvisor.com/ShowUserReviews-g60922-d255182-r386640318-Big_Cottonwood_Canyon-Salt_Lake_City_Utah.html","Mar 2016 • Friends","This is my favorite of all the canyons. There is an S curve and a cut through that are photographable. At the end is Sliver Lake, great from good weather walks on a boardwalk or for cross country skiing in the winter."
"https://www.tripadvisor.com/Attraction_Review-g60922-d255182-Reviews-Big_Cottonwood_Canyon-Salt_Lake_City_Utah.html","Big Cottonwood Canyon","teacher_rossi","Gorgeous Cottonwood Canyon","https://www.tripadvisor.com/ShowUserReviews-g60922-d255182-r386465573-Big_Cottonwood_Canyon-Salt_Lake_City_Utah.html","Jun 2016 • Solo","What can I say about this canyon? Living in Colorado, I can safely say I have seen some beautiful outdoor venues. Cottonwood Canyon definitely ranks up there with the best of what Colorado has to offer.
The canyon is easy to get to from I-15. The entire drive up the canyon is beautiful. And to top it off, their website is easy to navigate and makes finding trails a snap."
"https://www.tripadvisor.com/Attraction_Review-g60922-d255182-Reviews-Big_Cottonwood_Canyon-Salt_Lake_City_Utah.html","Big Cottonwood Canyon","Jackiegh","Good hiking- close to SLC","https://www.tripadvisor.com/ShowUserReviews-g60922-d255182-r386222631-Big_Cottonwood_Canyon-Salt_Lake_City_Utah.html","Jun 2016 • Couples","This was a good activity in the 2-3 hour window we had available. There are going trails alongside a river. It's beautiful."
"https://www.tripadvisor.com/Attraction_Review-g60922-d255182-Reviews-Big_Cottonwood_Canyon-Salt_Lake_City_Utah.html","Big Cottonwood Canyon","MelissaL0715","Beautiful, but a steep drive. Close to city. Worth the drive","https://www.tripadvisor.com/ShowUserReviews-g60922-d255182-r386163187-Big_Cottonwood_Canyon-Salt_Lake_City_Utah.html","Jun 2016 • Family","My daughter & I recently visited Salt Lake City and when it became busy downtown during rush hour, we opted to drive through Big Cottonwood Canyon. As you can see in the photos we are submitting, it is very beautiful. We stopped to take photos with the creeks/streams, as well as the mountain views. Worth the 20 minutes outside of downtown. Our rental car had a bit of a tough time climbing the steep mountain, but if you have a stronger car, you can probably go all the way to the ski area at the top (we did not)."
"https://www.tripadvisor.com/Attraction_Review-g60922-d255182-Reviews-Big_Cottonwood_Canyon-Salt_Lake_City_Utah.html","Big Cottonwood Canyon","pedsnephron","Beautiful drive","https://www.tripadvisor.com/ShowUserReviews-g60922-d255182-r386109553-Big_Cottonwood_Canyon-Salt_Lake_City_Utah.html","Jun 2016 • Family","We drove over Guardsman Pass from Park City narrow winding road, would not recommend taking a camper. We enjoyed the Donut Falls hike. We parked on the highway (cottonwood canyon road). Took us 75 min round trip, but at a modest pace. Easy to do with kids."
"https://www.tripadvisor.com/Attraction_Review-g60922-d255182-Reviews-Big_Cottonwood_Canyon-Salt_Lake_City_Utah.html","Big Cottonwood Canyon","dragonflytw65","Stunning","https://www.tripadvisor.com/ShowUserReviews-g60922-d255182-r385893853-Big_Cottonwood_Canyon-Salt_Lake_City_Utah.html","Jun 2016 • Friends","A friend from the area took us here for a short hike/walk. The drive through the canyon was stunning. It was around 7:00 in the evening and the temperature was cool in spite of the fact that that it had been close to 100 degrees in the valley during the day. Our walk around the lake was short, but what we saw was varied, big pines, aspens, flowers and views of amazing rocks. It was wonderful to see so many people enjoying the outdoors. I didn't want to leave. I am looking forward to visiting more often and exploring this canyon from corner to corner."
"https://www.tripadvisor.com/Attraction_Review-g60922-d255182-Reviews-Big_Cottonwood_Canyon-Salt_Lake_City_Utah.html","Big Cottonwood Canyon","Ann S","Like driving through a postcard","https://www.tripadvisor.com/ShowUserReviews-g60922-d255182-r385382888-Big_Cottonwood_Canyon-Salt_Lake_City_Utah.html","Jun 2016 • Friends","Soul food, pure soul food
I live in Virginia, Northern Virginia, where life is busy and we live compressed.
The foot hills and mountains in this part of Utah are soul food. The fresh clear space graces one with unconditional peace."
"https://www.tripadvisor.com/Attraction_Review-g60922-d255182-Reviews-Big_Cottonwood_Canyon-Salt_Lake_City_Utah.html","Big Cottonwood Canyon","RDB2004","Beautiful drive","https://www.tripadvisor.com/ShowUserReviews-g60922-d255182-r385108503-Big_Cottonwood_Canyon-Salt_Lake_City_Utah.html","Jun 2016 • Friends","Big Cottonwood Canyon is an easy drive into the mountains. By continuing on the road through the canyon, one passes ski lifts that offer scenic rides in the summer and then on to Park City itself."
"https://www.tripadvisor.com/Attraction_Review-g60922-d255182-Reviews-Big_Cottonwood_Canyon-Salt_Lake_City_Utah.html","Big Cottonwood Canyon","halilley","Get out more!","https://www.tripadvisor.com/ShowUserReviews-g60922-d255182-r384924052-Big_Cottonwood_Canyon-Salt_Lake_City_Utah.html","Jun 2016 • Couples","Stunning scenery, this is the road to Brighton (s ski resort) and Silver Lake. Still some snow about."
"https://www.tripadvisor.com/Attraction_Review-g60922-d255182-Reviews-Big_Cottonwood_Canyon-Salt_Lake_City_Utah.html","Big Cottonwood Canyon","LizzyB01","Silver Lake and Guardans' pass are my favs","https://www.tripadvisor.com/ShowUserReviews-g60922-d255182-r384646862-Big_Cottonwood_Canyon-Salt_Lake_City_Utah.html","Jun 2016 • Family","hiking around Silver lake to all the nearly lakes are very rewarding. Fishing is fun in the Silver lake as well. Guardsmans pass is always an exciting drive with rewarding views!"
"https://www.tripadvisor.com/Attraction_Review-g60922-d255182-Reviews-Big_Cottonwood_Canyon-Salt_Lake_City_Utah.html","Big Cottonwood Canyon","TheSuze12","Beautiful Canyon","https://www.tripadvisor.com/ShowUserReviews-g60922-d255182-r384133161-Big_Cottonwood_Canyon-Salt_Lake_City_Utah.html","Jun 2016 • Business","We drove to the top of the mountain and had the wonderful experience of snow in June. The drive was beautiful and there were many spots to hike and take beautiful photos. Be sure to stop at Silver Fork Lodge for a wonderful lunch on the deck."
"https://www.tripadvisor.com/Attraction_Review-g60922-d255182-Reviews-Big_Cottonwood_Canyon-Salt_Lake_City_Utah.html","Big Cottonwood Canyon","darlis73","Go with Salt Lake City Guided Tours","https://www.tripadvisor.com/ShowUserReviews-g60922-d255182-r383658002-Big_Cottonwood_Canyon-Salt_Lake_City_Utah.html","Jun 2016","We had a wonderful tour with SLC Guided Tours to the Wasatch Mountains. Brett was our guide and he was knowledgeable, fun and ver accommodating. If you want a great tour with great customer safety and satisfaction, I highly recommend this company! We went on 3 tours with this company and they are fantastic. Brett went above and beyond to give us a great experience!"
"https://www.tripadvisor.com/Attraction_Review-g60922-d255182-Reviews-Big_Cottonwood_Canyon-Salt_Lake_City_Utah.html","Big Cottonwood Canyon","scotiajim","Worth a drive up","https://www.tripadvisor.com/ShowUserReviews-g60922-d255182-r383301760-Big_Cottonwood_Canyon-Salt_Lake_City_Utah.html","Jun 2016 • Solo","Amazing drive up through the canyon to Brighton or over Guardsman's Pass to Park City. Lots of hiking trails and scenic views along the way."
"https://www.tripadvisor.com/Attraction_Review-g60922-d255182-Reviews-Big_Cottonwood_Canyon-Salt_Lake_City_Utah.html","Big Cottonwood Canyon","Jemmerson","Escape the city smog and heat!","https://www.tripadvisor.com/ShowUserReviews-g60922-d255182-r383182350-Big_Cottonwood_Canyon-Salt_Lake_City_Utah.html","Jun 2016 • Couples","Leave the smog and the heat of SLC behind and enjoy a quick drive to one of the many many hiking trails available up Big Cottonwood Canyon."
"https://www.tripadvisor.com/Attraction_Review-g60922-d255182-Reviews-Big_Cottonwood_Canyon-Salt_Lake_City_Utah.html","Big Cottonwood Canyon","Becky D","Beautiful drive!","https://www.tripadvisor.com/ShowUserReviews-g60922-d255182-r383085765-Big_Cottonwood_Canyon-Salt_Lake_City_Utah.html","Jun 2016 • Couples","We always drive up Big Cottonwood Canyon when in the Salt Lake City area! Beautiful drive! Solitude and Brighton ski areas are beautiful even without snow!"
"https://www.tripadvisor.com/Attraction_Review-g60922-d255182-Reviews-Big_Cottonwood_Canyon-Salt_Lake_City_Utah.html","Big Cottonwood Canyon","Bill S","Gorgeous Views","https://www.tripadvisor.com/ShowUserReviews-g60922-d255182-r382351419-Big_Cottonwood_Canyon-Salt_Lake_City_Utah.html","Jun 2016","We drove through the canyon on a rainy day and it was still absolutely beautiful! Bring your camera! You can just take a drive or you can drive and hike the many beautiful trails. Plan on at least an hour if you want to drive and take a few pictures otherwise take your time and get out and hike and spend the whole day there! It's hard to beat free!"
"https://www.tripadvisor.com/Attraction_Review-g60922-d255182-Reviews-Big_Cottonwood_Canyon-Salt_Lake_City_Utah.html","Big Cottonwood Canyon","Roni E","Breath taking scenery and hiking!","https://www.tripadvisor.com/ShowUserReviews-g60922-d255182-r382245462-Big_Cottonwood_Canyon-Salt_Lake_City_Utah.html","Jul 2015 • Solo","This amazing canyon is home to some of the best hiking in the world. The Brighton lakes, including Lake Mary, are some of the most beautiful alpine lakes in the world. The hike is not too difficult. I rate it as a moderate hike."
"https://www.tripadvisor.com/Attraction_Review-g60922-d255182-Reviews-Big_Cottonwood_Canyon-Salt_Lake_City_Utah.html","Big Cottonwood Canyon","Tomas W","ski in winter trail on summer","https://www.tripadvisor.com/ShowUserReviews-g60922-d255182-r381998216-Big_Cottonwood_Canyon-Salt_Lake_City_Utah.html","Jun 2016 • Couples","At least 20 degrees cooler than Salt lake city. It is the best place to stay in Summer There are many walking trail in the area. Some of them are difficult and some of them are short and easy, which are suitable for seniors"
"https://www.tripadvisor.com/Attraction_Review-g60922-d255182-Reviews-Big_Cottonwood_Canyon-Salt_Lake_City_Utah.html","Big Cottonwood Canyon","Silverwoods","Incredible hiking in the Wasatch mountains","https://www.tripadvisor.com/ShowUserReviews-g60922-d255182-r380088807-Big_Cottonwood_Canyon-Salt_Lake_City_Utah.html","Jun 2016 • Couples","This beautiful canyon on the way up to Solitude and Brighton is a hiking paradise. We did a 2.6 mile hike (1 way) up to Dog Lake. It was beautiful and serene. It was also a bit of a challenge which I really liked. The payoff at the end was the quiet, remote and tranquil dog lake. Very much worth the effort. When you get back down, go to the Silver Fork Lodge for a pint. Sit on the back deck."
"https://www.tripadvisor.com/Attraction_Review-g60922-d255182-Reviews-Big_Cottonwood_Canyon-Salt_Lake_City_Utah.html","Big Cottonwood Canyon","Sherry B","Visited this canyon 3 times in 1 week!!","https://www.tripadvisor.com/ShowUserReviews-g60922-d255182-r379695144-Big_Cottonwood_Canyon-Salt_Lake_City_Utah.html","May 2016 • Couples","Always love driving up this canyon. We went three times! Had one beautiful sunny day and two snowy days. Loved the snow days! Had so much fun walking in the Silver Lake area. The lake area still had LOTS of snow! You need to take this FREE drive. Stop often to enjoy the views. Silver Lake charges during the winter for cross country skiing and snowshoeing ($5/adult)."
"https://www.tripadvisor.com/Attraction_Review-g60922-d255182-Reviews-Big_Cottonwood_Canyon-Salt_Lake_City_Utah.html","Big Cottonwood Canyon","Still Crazy after all these years","Awesome scenery with great hiking trails","https://www.tripadvisor.com/ShowUserReviews-g60922-d255182-r379220957-Big_Cottonwood_Canyon-Salt_Lake_City_Utah.html","May 2016 • Couples","We were very impressed with the trails and scenery in the area.. definitely would visit again. We hiked for 4 days and had a marvelous time"
"https://www.tripadvisor.com/Attraction_Review-g60922-d255182-Reviews-Big_Cottonwood_Canyon-Salt_Lake_City_Utah.html","Big Cottonwood Canyon","RayMiami","This place is amazing","https://www.tripadvisor.com/ShowUserReviews-g60922-d255182-r379188959-Big_Cottonwood_Canyon-Salt_Lake_City_Utah.html","May 2016 • Couples","The snow was melting and the skiing resorts were close for the season but the place kept its beauty. If you are in Salt Lake City for a day and have a car take the drive all the way to the end of the Canyon it is breath taking."
"https://www.tripadvisor.com/Attraction_Review-g60922-d255182-Reviews-Big_Cottonwood_Canyon-Salt_Lake_City_Utah.html","Big Cottonwood Canyon","Jennifer J","Alpine Splendor in the Wasatch","https://www.tripadvisor.com/ShowUserReviews-g60922-d255182-r378833115-Big_Cottonwood_Canyon-Salt_Lake_City_Utah.html","Mar 2016 • Couples","Whatever your outdoor activities, this canyon has it all in spades--best Skiing in the world, gorgeous hiking, biking and whatever your fancy in Autumn, Spring and Summer.
Snowbird Resort has fantastic amenities for everyone in the family--catch Octoberfest in the fall and ride the tram to the top. Mountain majesty that compares to the European Alps."
"https://www.tripadvisor.com/Attraction_Review-g60922-d255182-Reviews-Big_Cottonwood_Canyon-Salt_Lake_City_Utah.html","Big Cottonwood Canyon","pray4powder","Great skiing in the winter; hiking and mountain biking in the summer","https://www.tripadvisor.com/ShowUserReviews-g60922-d255182-r378793470-Big_Cottonwood_Canyon-Salt_Lake_City_Utah.html","Mar 2016 • Friends","In addition, stop at the Silver Fork lodge for breakfast. I recommend the corn-beef hash, but they turn-off the breakfast menu at about 11:00 am."
"https://www.tripadvisor.com/Attraction_Review-g60922-d255182-Reviews-Big_Cottonwood_Canyon-Salt_Lake_City_Utah.html","Big Cottonwood Canyon","loielee","So Beautiful here","https://www.tripadvisor.com/ShowUserReviews-g60922-d255182-r378659584-Big_Cottonwood_Canyon-Salt_Lake_City_Utah.html","Oct 2015","I love going up this canyon. My most favorite thing to do is walk around Silver Lake. It is so peaceful here, it makes me feel like I'm on vacation even though it's close to home. The mountain air is awesome."
"https://www.tripadvisor.com/Attraction_Review-g60922-d255182-Reviews-Big_Cottonwood_Canyon-Salt_Lake_City_Utah.html","Big Cottonwood Canyon","walkingjudi","Spectacular hikes","https://www.tripadvisor.com/ShowUserReviews-g60922-d255182-r377307965-Big_Cottonwood_Canyon-Salt_Lake_City_Utah.html","May 2016 • Friends","The hiking trails are well maintained, and there are hikes to suit every level of fitness. It's especially beautiful in the fall. I hike there frequently."
"https://www.tripadvisor.com/Attraction_Review-g60922-d255182-Reviews-Big_Cottonwood_Canyon-Salt_Lake_City_Utah.html","Big Cottonwood Canyon","Clark H","Classic Canyon Experience","https://www.tripadvisor.com/ShowUserReviews-g60922-d255182-r377094921-Big_Cottonwood_Canyon-Salt_Lake_City_Utah.html","Sep 2015","The largest and most varied canyon in the Wasatch with miles of hiking trails, two ski resorts, great cross country skiing, and a variety of lakes. The Best of the Wasatch!"
"https://www.tripadvisor.com/Attraction_Review-g60922-d255182-Reviews-Big_Cottonwood_Canyon-Salt_Lake_City_Utah.html","Big Cottonwood Canyon","bbfgator","Beautiful","https://www.tripadvisor.com/ShowUserReviews-g60922-d255182-r376697639-Big_Cottonwood_Canyon-Salt_Lake_City_Utah.html","May 2016","Enjoyed our ride through the canyon last week. Was surprised that Guardsman Pass still closed. Silver Lake was beautiful but boardwalk still covered in snow....we walked on the snow around though. Some of the lake was melted but 75% still covered. Beautiful area. Donut Falls hike was a nice hike although we thought a little tougher than easy but then we're flat-landers from Florida."
"https://www.tripadvisor.com/Attraction_Review-g60922-d255182-Reviews-Big_Cottonwood_Canyon-Salt_Lake_City_Utah.html","Big Cottonwood Canyon","WasatchDave","Wonderful mountain get-away a few miles from the city","https://www.tripadvisor.com/ShowUserReviews-g60922-d255182-r376579051-Big_Cottonwood_Canyon-Salt_Lake_City_Utah.html","Aug 2015 • Family","We drive up Big Cottonwood Canyon several times a year. Especially enjoy hiking around Silver Lake at Brighton and spending a few nights with family at Solitude Ski Resort during the summer. The Spruces campground can't be beat. A road over the mountain from Brighton takes you to Park City or Heber Valley."
"https://www.tripadvisor.com/Attraction_Review-g60922-d255182-Reviews-Big_Cottonwood_Canyon-Salt_Lake_City_Utah.html","Big Cottonwood Canyon","HeyRossi","Rock climbing and hiking playground","https://www.tripadvisor.com/ShowUserReviews-g60922-d255182-r375922383-Big_Cottonwood_Canyon-Salt_Lake_City_Utah.html","May 2016 • Friends","This canyon is just a short drive from Salt Lake City and no matter your skill level, you can find a great activity.
The ski resorts Brighton and Solitude are located up this canyon, as well as popular hikes such as Lake Blanche and White Pine and Red Pine Lakes.
There is also incredible sport rock climbing ranging from easier routes to belay into to more challenging routes.
Don't miss this canyon if you're in the area."
"https://www.tripadvisor.com/Attraction_Review-g60922-d255182-Reviews-Big_Cottonwood_Canyon-Salt_Lake_City_Utah.html","Big Cottonwood Canyon","RoNeh","Nice place to drive/hike","https://www.tripadvisor.com/ShowUserReviews-g60922-d255182-r373912819-Big_Cottonwood_Canyon-Salt_Lake_City_Utah.html","May 2016 • Friends","My friends had a few hours to spend in SLC. We drove around Big Cottonwood Canyon and admire the beauty of Mother Nature! Winding roads and big canyon mountains. People hiking and biking. It's peaceful and beautiful to observe nature!"
