"places_url_link","places_url_place","places_url_reviews_name","places_url_reviews_title","places_url_reviews_title_url","places_url_reviews_date","places_url_reviews_comment"
"https://www.tripadvisor.com/Attraction_Review-g60922-d255182-Reviews-Big_Cottonwood_Canyon-Salt_Lake_City_Utah.html","Big Cottonwood Canyon","stu_uk","Beautiful drive and scenery","https://www.tripadvisor.com/ShowUserReviews-g60922-d255182-r531951205-Big_Cottonwood_Canyon-Salt_Lake_City_Utah.html","Aug 2017 • Couples","This is such a lovely place to visit. The scenic drive is beautiful and we really enjoyed the walk around Silver Lake with it's scenery and wildlife."
"https://www.tripadvisor.com/Attraction_Review-g60922-d255182-Reviews-Big_Cottonwood_Canyon-Salt_Lake_City_Utah.html","Big Cottonwood Canyon","JKD1313","Wow","https://www.tripadvisor.com/ShowUserReviews-g60922-d255182-r531832357-Big_Cottonwood_Canyon-Salt_Lake_City_Utah.html","Oct 2017","Wow is all I can say. We did a drive through the canyon on our way from SLC to Park City. Some areas are a little scary. Amazing!"
"https://www.tripadvisor.com/Attraction_Review-g60922-d255182-Reviews-Big_Cottonwood_Canyon-Salt_Lake_City_Utah.html","Big Cottonwood Canyon","Portland222","Early snow !","https://www.tripadvisor.com/ShowUserReviews-g60922-d255182-r531567176-Big_Cottonwood_Canyon-Salt_Lake_City_Utah.html","Oct 2017 • Couples","Beautiful drive this time of year . There is a posted sign that says snow tires from Oct 1. We were driving a rental car which did not have snow tires. It was raining lightly but as we climbed higher, the temp dropped to 34 very quickly , & the rain turned to light snow. We had no problem, but just wanted to give a head’s up to tourists from other areas who are not used to driving in snow— check the forecast before you go, as the temp can drop quickly! The scenery is lovely w reds, golds, & greens."
"https://www.tripadvisor.com/Attraction_Review-g60922-d255182-Reviews-Big_Cottonwood_Canyon-Salt_Lake_City_Utah.html","Big Cottonwood Canyon","Wayne K","Nice drive in the country","https://www.tripadvisor.com/ShowUserReviews-g60922-d255182-r531538104-Big_Cottonwood_Canyon-Salt_Lake_City_Utah.html","Oct 2017 • Couples","Easy drive through the canyon up to the ski fields.
Interesting countryside, it is a canyon after all (and quite narrow in parts).
Pretty colours in Autumn (Fall)."
"https://www.tripadvisor.com/Attraction_Review-g60922-d255182-Reviews-Big_Cottonwood_Canyon-Salt_Lake_City_Utah.html","Big Cottonwood Canyon","CalifDoug","Canyon Bonanza","https://www.tripadvisor.com/ShowUserReviews-g60922-d255182-r531494720-Big_Cottonwood_Canyon-Salt_Lake_City_Utah.html","Oct 2017 • Solo","You can do just about any canyon activity in Big Cottonwood. Beautiful and dramatic geology.
Right now (October) is the best time to view fall foliage. It is also not too late for a good hike--try Dog Lake up Butler's Fork and down Mill D north fork for a great half-day moderately strenuous one. Or Donut Falls for an easy hour. Or Cecret Lake for moderate.
July is best for wildflowers.
Of course, skiing in the winter!
Go most of the way up and then over Guardsman Pass into charming Midway and get some ice cream & cheese at Heber Valley Artisan Cheeses."
"https://www.tripadvisor.com/Attraction_Review-g60922-d255182-Reviews-Big_Cottonwood_Canyon-Salt_Lake_City_Utah.html","Big Cottonwood Canyon","Tony d","Fall beauty","https://www.tripadvisor.com/ShowUserReviews-g60922-d255182-r531130617-Big_Cottonwood_Canyon-Salt_Lake_City_Utah.html","Oct 2017 • Couples","We live amongst some of the most beautiful places I have seen. Our canyons are just amazing during the fall as they change their colors. Then, when winter comes, they are blanketed with the best snow on earth. Then in summer, there are thousands of trails to walk or bike. Just awesome!"
"https://www.tripadvisor.com/Attraction_Review-g60922-d255182-Reviews-Big_Cottonwood_Canyon-Salt_Lake_City_Utah.html","Big Cottonwood Canyon","PJ G","Beautiful views","https://www.tripadvisor.com/ShowUserReviews-g60922-d255182-r530481203-Big_Cottonwood_Canyon-Salt_Lake_City_Utah.html","Oct 2017 • Solo","I like this canyon because of the variety of rock layers visible. It's a mild drive with a pretty creek near nice picnic areas. At the top are two ski resorts and the beginning of Guardsmen pass which will take you over the mountains to Park City."
"https://www.tripadvisor.com/Attraction_Review-g60922-d255182-Reviews-Big_Cottonwood_Canyon-Salt_Lake_City_Utah.html","Big Cottonwood Canyon","rbonosconi","Big Cottonwood Canyon","https://www.tripadvisor.com/ShowUserReviews-g60922-d255182-r530365029-Big_Cottonwood_Canyon-Salt_Lake_City_Utah.html","Aug 2017 • Couples","This beautiful canyon never disappoints! Many great vistas and opportunities to pull off the road and enjoy the view. A nice Sunday drive, or Saturday park and hike kind of place. I get up there as often as my schedule permits."
"https://www.tripadvisor.com/Attraction_Review-g60922-d255182-Reviews-Big_Cottonwood_Canyon-Salt_Lake_City_Utah.html","Big Cottonwood Canyon","April W","Get away from the city","https://www.tripadvisor.com/ShowUserReviews-g60922-d255182-r529258420-Big_Cottonwood_Canyon-Salt_Lake_City_Utah.html","Sep 2017 • Friends","Big Cottonwood Canyon is a lovely place to get away from Salt Lake. Go and walk around Silver Lake. Silver Lake is wonderful in summer with wildflowers and in the fall when the aspens change color."
"https://www.tripadvisor.com/Attraction_Review-g60922-d255182-Reviews-Big_Cottonwood_Canyon-Salt_Lake_City_Utah.html","Big Cottonwood Canyon","Debra E","I love this canyon","https://www.tripadvisor.com/ShowUserReviews-g60922-d255182-r529161730-Big_Cottonwood_Canyon-Salt_Lake_City_Utah.html","Nov 2016 • Friends","Right above the Brighton Resort, you can hike to 4 lakes in a short amount of time. stunning views & scenery. I you want to see more, continue up & over to Little Cottonwood Canyon."
"https://www.tripadvisor.com/Attraction_Review-g60922-d255182-Reviews-Big_Cottonwood_Canyon-Salt_Lake_City_Utah.html","Big Cottonwood Canyon","Rodneyrogers","Many options to hike, camp or sight see!","https://www.tripadvisor.com/ShowUserReviews-g60922-d255182-r529145111-Big_Cottonwood_Canyon-Salt_Lake_City_Utah.html","Aug 2017 • Couples","There is a short hike up to a waterfall that is great year round! If it is not snowbound in the winter, the frozen waterfall is incredible! Always a great hike in Fall with the beautiful colors!"
"https://www.tripadvisor.com/Attraction_Review-g60922-d255182-Reviews-Big_Cottonwood_Canyon-Salt_Lake_City_Utah.html","Big Cottonwood Canyon","SquirrelGirl39","Brighton Lakes Trail","https://www.tripadvisor.com/ShowUserReviews-g60922-d255182-r528767237-Big_Cottonwood_Canyon-Salt_Lake_City_Utah.html","Sep 2017 • Couples","Big Cottonwood Canyon is beautiful. We chose to do the Brighton Lakes Trail and it was a great hike. I would have given 5 circles but I had read that the hike started at the Lodge instead of the Center and the sign for the hike was just placed against a tree. We followed a path for about fifteen minutes before we decided it wasn't right and we turned around. We did get to see a deer on that trail so it was worth it. On the correct trail, we saw a moose at Dog Lake and I had never seen one before, so this was definitely a highlight!"
"https://www.tripadvisor.com/Attraction_Review-g60922-d255182-Reviews-Big_Cottonwood_Canyon-Salt_Lake_City_Utah.html","Big Cottonwood Canyon","Kristine M","Great hiking!","https://www.tripadvisor.com/ShowUserReviews-g60922-d255182-r528360503-Big_Cottonwood_Canyon-Salt_Lake_City_Utah.html","Sep 2017 • Friends","I have been up the canyon so many times since my children were little that I've lost count. It is one of my favorite places on Earth. Silver Lake to Lake Solitude is a perfect hike for me alone or with children. Donut Falls is also a mild hike. Lake Mary has to be one of the most beautiful lakes on this planet -- a deep blue that took some dedicated workers to build. You can still find the building implements left at the site. There's Dog Lake, Lake Blanche, and the Albion Trail if you want to cross over into Little Cottonwood Canyon. Even in the middle of summer, I frequently find snow patches so the temps are quite exhilarating."
"https://www.tripadvisor.com/Attraction_Review-g60922-d255182-Reviews-Big_Cottonwood_Canyon-Salt_Lake_City_Utah.html","Big Cottonwood Canyon","Dave B","Great hikes and incredible views","https://www.tripadvisor.com/ShowUserReviews-g60922-d255182-r527927491-Big_Cottonwood_Canyon-Salt_Lake_City_Utah.html","Sep 2017 • Friends","Big Cottonwood Canyon is one of my favorite places to go. A beautiful drive followed by a brisk walk, enjoying the views and the fresh air."
"https://www.tripadvisor.com/Attraction_Review-g60922-d255182-Reviews-Big_Cottonwood_Canyon-Salt_Lake_City_Utah.html","Big Cottonwood Canyon","Adriana S","Quick Scenic Drive but OH SO beautiful!","https://www.tripadvisor.com/ShowUserReviews-g60922-d255182-r527908459-Big_Cottonwood_Canyon-Salt_Lake_City_Utah.html","Sep 2017 • Couples","My husband and I didn't have enough time to check out all the amazing sights BCC has to offer but wow, what a drive! Just 15 minutes in and we were drooling over the sights. Pulled over for beautiful photos and made a promise to go back some day! Even if you can only swing by for a bit, do carve out some time--it's one of the most scenic drives we've ever done."
"https://www.tripadvisor.com/Attraction_Review-g60922-d255182-Reviews-Big_Cottonwood_Canyon-Salt_Lake_City_Utah.html","Big Cottonwood Canyon","DBearNC","Beautiful Drive","https://www.tripadvisor.com/ShowUserReviews-g60922-d255182-r526784566-Big_Cottonwood_Canyon-Salt_Lake_City_Utah.html","Sep 2017 • Couples","My wife and I drove down Big Cottonwood Canyon on our way from Provo to SLC. While we did not have time to do any hiking, we saw lots of trail heads along the way. The scenery got better as we went down the canyon. The road is in very good condition with lots of places to pull over and take photos."
"https://www.tripadvisor.com/Attraction_Review-g60922-d255182-Reviews-Big_Cottonwood_Canyon-Salt_Lake_City_Utah.html","Big Cottonwood Canyon","Magnus","Lake Mary, Lake Martha & Lake Chatherine","https://www.tripadvisor.com/ShowUserReviews-g60922-d255182-r525847982-Big_Cottonwood_Canyon-Salt_Lake_City_Utah.html","Sep 2017 • Friends","Wonderful trip in Big Cottonwood Canyon. A sunny day in September. What views and landscapes! Go there!"
"https://www.tripadvisor.com/Attraction_Review-g60922-d255182-Reviews-Big_Cottonwood_Canyon-Salt_Lake_City_Utah.html","Big Cottonwood Canyon","mothership1","Spectacular Rocky mountains at their best","https://www.tripadvisor.com/ShowUserReviews-g60922-d255182-r525730799-Big_Cottonwood_Canyon-Salt_Lake_City_Utah.html","Sep 2017 • Family","Take the time to stop at the Silver Lake visitors center and go for a hike. The views just don't stop."
"https://www.tripadvisor.com/Attraction_Review-g60922-d255182-Reviews-Big_Cottonwood_Canyon-Salt_Lake_City_Utah.html","Big Cottonwood Canyon","carriejane777","Lake Blanche Mill B South Trail","https://www.tripadvisor.com/ShowUserReviews-g60922-d255182-r525020997-Big_Cottonwood_Canyon-Salt_Lake_City_Utah.html","Sep 2017 • Couples","I think this was about nine miles round trip with a 2,800 ft elevation gain. There's a good amount of shade but it still was pretty hot, so I definitely recommend starting early and bringing lots of water. There's nothing challenging other than the really strenuous elevation gain. I was really sore for days! Make sure you don't go fast on your way down because the steepness murdered my legs."
"https://www.tripadvisor.com/Attraction_Review-g60922-d255182-Reviews-Big_Cottonwood_Canyon-Salt_Lake_City_Utah.html","Big Cottonwood Canyon","ERFSU82","Scenic drive, beautiful vistas.","https://www.tripadvisor.com/ShowUserReviews-g60922-d255182-r524593552-Big_Cottonwood_Canyon-Salt_Lake_City_Utah.html","Aug 2017 • Solo","Less than 30 minutes from downtown SLC, the drive up the canyon makes for a nice escape to nature. The drive itself is beautiful, with amazing rock formations the first few miles, followed by wildflowers, waterfalls, and green meadows. There are many places along the way to pull over for better views and to get some great photos. There are some amazing hiking trails and some nice spots to simply sit, relax, and take in nature. The drive takes you to Solitude Resort, then to Brighton Resort, about two miles further up the road, where the canyon ends. During the summer, I highly recommend taking the drive up Guardsman's Pass, which is an incredibly scenic drive that takes you up to the backside of Jupiter Bowl at Park City, then down into the Deer Valley Resort area. At the top of the pass, there's a small dirt parking lot, where you can park and spend some time taking in the amazing views. If you want to stand at the top of Jupiter Bowl and look back over Park City, there is a small dirt road that curves up the hill across the street. It's about a 1/4 mile uphill walk, but it's relatively easy and you'll be rewarded with some terrific views.
If you're short on time, the drive up and back through Big Cottonwood Canyon will take less than two hours round trip from downtown SLC, assuming no stops along the way. If you have several hours, it's well worth making the Guardsman's Pass drive, then exploring Deer Valley and Park City before returning to SLC via I-80."
"https://www.tripadvisor.com/Attraction_Review-g60922-d255182-Reviews-Big_Cottonwood_Canyon-Salt_Lake_City_Utah.html","Big Cottonwood Canyon","Barbara S","Beautiful, Short, Hike","https://www.tripadvisor.com/ShowUserReviews-g60922-d255182-r524494144-Big_Cottonwood_Canyon-Salt_Lake_City_Utah.html","Jul 2017 • Family","Big Cottonwood Canyon is an excellent place to spend a summer day, see fall leaves, ski during Utah's winter months or see spring wildflowers. The road is narrow in spots with a few tight bends, but it is well maintained and paved. I was in the canyon most recently to beat the heat with a short hike to Donut Falls on a hot summer day. The trail was crowded, as there were many people who had the same great idea, but it was still a lovely jaunt into wildflowers, meadows, and over a few rocks. There was plenty of wildlife to see despite the humans. The falls are pretty, but a little underwhelming, but in this case, it's about the journey as much as it is about the destination."
"https://www.tripadvisor.com/Attraction_Review-g60922-d255182-Reviews-Big_Cottonwood_Canyon-Salt_Lake_City_Utah.html","Big Cottonwood Canyon","Mary K","The Drive down Big Cottonwood Canyon was Stunning.","https://www.tripadvisor.com/ShowUserReviews-g60922-d255182-r524394838-Big_Cottonwood_Canyon-Salt_Lake_City_Utah.html","Aug 2017 • Couples","After visiting Park City for part of the day, we chose to drive Big cottonwood Canyon road back to the Salt Lake City Area. The switchbacks were fun and views were worth it."
"https://www.tripadvisor.com/Attraction_Review-g60922-d255182-Reviews-Big_Cottonwood_Canyon-Salt_Lake_City_Utah.html","Big Cottonwood Canyon","turbotrevor","Amazing and Beautful and So Close to the City!","https://www.tripadvisor.com/ShowUserReviews-g60922-d255182-r524090830-Big_Cottonwood_Canyon-Salt_Lake_City_Utah.html","Jul 2017 • Couples","Big Cottonwood Canyon is a beautiful drive that's worth it just to see. But it's also a cool way to get up to Park City that's a little more interesting than the highway. There are a few great hikes right off the road, especially Doughnut Falls. Love this place!"
"https://www.tripadvisor.com/Attraction_Review-g60922-d255182-Reviews-Big_Cottonwood_Canyon-Salt_Lake_City_Utah.html","Big Cottonwood Canyon","jblackeagle555","Amazing hiking","https://www.tripadvisor.com/ShowUserReviews-g60922-d255182-r523812556-Big_Cottonwood_Canyon-Salt_Lake_City_Utah.html","Sep 2017 • Business","Beautiful views! Great place to spend time hiking and enjoying the outdoors! Very relaxing. Fun for the whole family or just to get away by yourself. Nice for a romantic walk!"
"https://www.tripadvisor.com/Attraction_Review-g60922-d255182-Reviews-Big_Cottonwood_Canyon-Salt_Lake_City_Utah.html","Big Cottonwood Canyon","Seafolly","Glorious views and wildflowers","https://www.tripadvisor.com/ShowUserReviews-g60922-d255182-r523629559-Big_Cottonwood_Canyon-Salt_Lake_City_Utah.html","Aug 2017 • Couples","Took a late afternoon hike here and was a good 10 degrees (celcius) difference to down town. Abundance of wildflowers and views all around. Highly recommended."
"https://www.tripadvisor.com/Attraction_Review-g60922-d255182-Reviews-Big_Cottonwood_Canyon-Salt_Lake_City_Utah.html","Big Cottonwood Canyon","erocker73","Best hiking ever!","https://www.tripadvisor.com/ShowUserReviews-g60922-d255182-r523274340-Big_Cottonwood_Canyon-Salt_Lake_City_Utah.html","Jul 2017 • Family","My wife and I have 2️ boys. A 4 year old and a 1 year old. I work retail, so I'm always busy. But on my days off, we always go hiking. Big cottonwood in general is our go to place for a variety of hikes. Mellow for the kids, beautiful scenery and plenty of waterfalls to cool off in. We love it!"
"https://www.tripadvisor.com/Attraction_Review-g60922-d255182-Reviews-Big_Cottonwood_Canyon-Salt_Lake_City_Utah.html","Big Cottonwood Canyon","Linda095","A must visit if you are in the area!","https://www.tripadvisor.com/ShowUserReviews-g60922-d255182-r522629589-Big_Cottonwood_Canyon-Salt_Lake_City_Utah.html","Jun 2017 • Couples","Spent a fabulous couple of days in Big Cottonwood Canyon. Trails are easily marked and even the up hill trails were worth the views :)"
"https://www.tripadvisor.com/Attraction_Review-g60922-d255182-Reviews-Big_Cottonwood_Canyon-Salt_Lake_City_Utah.html","Big Cottonwood Canyon","Bryon M","My beautiful gem","https://www.tripadvisor.com/ShowUserReviews-g60922-d255182-r522285261-Big_Cottonwood_Canyon-Salt_Lake_City_Utah.html","Aug 2017 • Couples","I have been visiting this canyon for the past 45 years. It has been a quick get away and a means of reconnecting with the beauty of nature. It has some of the best hiking trails, camping, fishing, skiing and dining anywhere in the world. Unfortunately as the Salt Lake Valley swells in population, so do the canyons. Please respect this fragile ecosystem and leave no trace. Make it a place our families will enjoy for the next thousand years."
"https://www.tripadvisor.com/Attraction_Review-g60922-d255182-Reviews-Big_Cottonwood_Canyon-Salt_Lake_City_Utah.html","Big Cottonwood Canyon","Ken J","Great getaway to the Spruce Camp Ground","https://www.tripadvisor.com/ShowUserReviews-g60922-d255182-r522045604-Big_Cottonwood_Canyon-Salt_Lake_City_Utah.html","Sep 2017 • Friends","Every year we rent you the camp ground for a dinner event that feeds 150 people.
We love the area
Very photogenic and awe inspiring"
"https://www.tripadvisor.com/Attraction_Review-g60922-d255182-Reviews-Big_Cottonwood_Canyon-Salt_Lake_City_Utah.html","Big Cottonwood Canyon","SECYANKEE","Big, Beautiful, and Accesible","https://www.tripadvisor.com/ShowUserReviews-g60922-d255182-r522043201-Big_Cottonwood_Canyon-Salt_Lake_City_Utah.html","Aug 2017 • Family","It's the fastest, easiest to access canyon in the valley. The ski resorts are only about 20 minutes up the mountain and there is plenty of hiking in the summer. Winter, unless it's snowing hard, is also accessible, but recommend 4X4."
"https://www.tripadvisor.com/Attraction_Review-g60922-d255182-Reviews-Big_Cottonwood_Canyon-Salt_Lake_City_Utah.html","Big Cottonwood Canyon","SunDancer1","Must see while visiting Salt Lake City","https://www.tripadvisor.com/ShowUserReviews-g60922-d255182-r522014411-Big_Cottonwood_Canyon-Salt_Lake_City_Utah.html","Aug 2017 • Family","It's hard to believe this tranquil canyon is only minutes away from a major city! The scenery is beautiful and there are many things for every member of your family to do. Hiking, biking, fishing, climbing, camping. The wildflowers are beautiful in the summer, the leaves breathtaking in the summer, and the skiing phenomenal in the winter. Don't miss it!"
"https://www.tripadvisor.com/Attraction_Review-g60922-d255182-Reviews-Big_Cottonwood_Canyon-Salt_Lake_City_Utah.html","Big Cottonwood Canyon","wendybird5","So many trails so little time!","https://www.tripadvisor.com/ShowUserReviews-g60922-d255182-r522009759-Big_Cottonwood_Canyon-Salt_Lake_City_Utah.html","Sep 2017 • Friends","Hiking trails galore. Fields of flowers clear until august! You can't go wrong pulling over to one of the many trail heads up Big Cottonwood Canyon."
"https://www.tripadvisor.com/Attraction_Review-g60922-d255182-Reviews-Big_Cottonwood_Canyon-Salt_Lake_City_Utah.html","Big Cottonwood Canyon","AM7D","Beautiful drive and lovely canyon.","https://www.tripadvisor.com/ShowUserReviews-g60922-d255182-r521978110-Big_Cottonwood_Canyon-Salt_Lake_City_Utah.html","Sep 2017 • Couples","I love Big Cottonwood Canyon. The drive is beautiful, especially in the fall. Nice walking trails and yummy restaurants close by."
"https://www.tripadvisor.com/Attraction_Review-g60922-d255182-Reviews-Big_Cottonwood_Canyon-Salt_Lake_City_Utah.html","Big Cottonwood Canyon","Forest W","Awesome Vistas","https://www.tripadvisor.com/ShowUserReviews-g60922-d255182-r521245897-Big_Cottonwood_Canyon-Salt_Lake_City_Utah.html","Sep 2017 • Couples","If you can keep your eyes on the road this is a great drive. Careful there are tons of vehicles parked on the side of the road where they have off loaded for hikers. There are several pullouts where you can take photos."
"https://www.tripadvisor.com/Attraction_Review-g60922-d255182-Reviews-Big_Cottonwood_Canyon-Salt_Lake_City_Utah.html","Big Cottonwood Canyon","Polina K","Lots of choices of outdoor activities - beautiful!","https://www.tripadvisor.com/ShowUserReviews-g60922-d255182-r520100867-Big_Cottonwood_Canyon-Salt_Lake_City_Utah.html","Aug 2017 • Friends","Beautiful drive up with many stops full of hikes, bike trails, climbing spots, and disc golf course at Solitude. One of the local favorites!"
"https://www.tripadvisor.com/Attraction_Review-g60922-d255182-Reviews-Big_Cottonwood_Canyon-Salt_Lake_City_Utah.html","Big Cottonwood Canyon","Desistarr","Beautiful Scenery","https://www.tripadvisor.com/ShowUserReviews-g60922-d255182-r519925420-Big_Cottonwood_Canyon-Salt_Lake_City_Utah.html","Aug 2017 • Couples","We were able to witness the most breath-taking double rainbow in this canyon. Excellent views with plenty of wildlife."
"https://www.tripadvisor.com/Attraction_Review-g60922-d255182-Reviews-Big_Cottonwood_Canyon-Salt_Lake_City_Utah.html","Big Cottonwood Canyon","dyerta","Nice day trip from Salt Lake City.","https://www.tripadvisor.com/ShowUserReviews-g60922-d255182-r518891198-Big_Cottonwood_Canyon-Salt_Lake_City_Utah.html","Aug 2017 • Couples","It was a nice day drive through the canyon with a number of places to stop for short or longer hikes. One hint: being from Maine we started at sea level and noticed some fatigue trying to hike at over 8000 feet the next day."
"https://www.tripadvisor.com/Attraction_Review-g60922-d255182-Reviews-Big_Cottonwood_Canyon-Salt_Lake_City_Utah.html","Big Cottonwood Canyon","Kevin P","Lot's of hard climbing in this place!","https://www.tripadvisor.com/ShowUserReviews-g60922-d255182-r518084908-Big_Cottonwood_Canyon-Salt_Lake_City_Utah.html","Aug 2017 • Friends","Which is a shame really as there seemed so much to do here. Not really for the average climber, the routes are way too hard, and the gradings seem to be off by about 2 grades compared to elsewhere (a 5.7 feels like a 5.9). As the median grade here is about a 5.11b, you will get crowded out in the weekends as there aren't relatively that many easier climbs here.
The climbs are on quartzite, a type of metamorphasised sandstone, which normally is quite strong (see the Arapiles in Australia). However this place seemed to have a lot of loose rock, and it was hard to place nuts/stoppers. So you need quite a big rack of cams to climb here (20?). Having said that, the quartzite here is an excellent challenge for those who want to be a truly international climber, but seems to be stuck on granite which dominates 70% of USA crags. It can have a slippery surface, and it will take a while to read where the holds are!
The routes are typically 1-3 pitches long so not a big day out/adventure. And you need to start early so you don't get caught by summer afternoon thunderstorms.
Good luck :)"
"https://www.tripadvisor.com/Attraction_Review-g60922-d255182-Reviews-Big_Cottonwood_Canyon-Salt_Lake_City_Utah.html","Big Cottonwood Canyon","HoleySneakers","Stunning Views Within Minutes of Salt Lake","https://www.tripadvisor.com/ShowUserReviews-g60922-d255182-r514741659-Big_Cottonwood_Canyon-Salt_Lake_City_Utah.html","Aug 2017","Big Cottonwood Canyon is one of the two canyons that end at the Salt Lake area's famous Wasatch mountain ski resorts (Little Cottonwood Canyon is the other). In the summer, they are stunning scenic drives that provide access to many hiking trails. In my opinion Big Cottonwood Canyon is the more dramatic of the two, and if you're only going to explore one of them, I say choose this one. Not only is the scenery awe-inspiring, but the drive ends in a loop through the tiny but picturesque ski resort town of Brighton. In Brighton, you can stop at the cafe and relax and enjoy the view of the mountain amphitheater that surrounds the town. Important note: there are no dogs allowed in the canyon at all (for protection of the watershed)."
