"places_url_link","places_url_place","places_url_reviews_name","places_url_reviews_title","places_url_reviews_title_url","places_url_reviews_date","places_url_reviews_comment"
"https://www.tripadvisor.com/Attraction_Review-g60922-d255182-Reviews-Big_Cottonwood_Canyon-Salt_Lake_City_Utah.html","Big Cottonwood Canyon","csolsen2","No place is more beautiful.","https://www.tripadvisor.com/ShowUserReviews-g60922-d255182-r236176343-Big_Cottonwood_Canyon-Salt_Lake_City_Utah.html","Oct 2014 • Friends","Okay, I am biased a little. Living here pretty much my whole life, their is nothing I love more than to jump in my Jeep with the top down and the doors off, and drive up this canyon in the fall. It is majestic. Go for a hike, take a walk through the aspen groves. Have a bite at Snowbird or The Shallow Shaft. When you do, you will understand what makes Utah the place it is. Open the windows, put the top down on your car. Smell the air. You will understand."
"https://www.tripadvisor.com/Attraction_Review-g60922-d255182-Reviews-Big_Cottonwood_Canyon-Salt_Lake_City_Utah.html","Big Cottonwood Canyon","pblaha","You need a full day to truly appreciate this place.","https://www.tripadvisor.com/ShowUserReviews-g60922-d255182-r235299885-Big_Cottonwood_Canyon-Salt_Lake_City_Utah.html","Oct 2014 • Business","If you are looking for something to do while in SLC, Big Cottonwood Canyon will not disappoint. Talk about scenic views, this area has many hiking trails. You can easily spend an entire day here."
"https://www.tripadvisor.com/Attraction_Review-g60922-d255182-Reviews-Big_Cottonwood_Canyon-Salt_Lake_City_Utah.html","Big Cottonwood Canyon","yyyzzz_utah","plenty of hiking trails and fun spots","https://www.tripadvisor.com/ShowUserReviews-g60922-d255182-r234240743-Big_Cottonwood_Canyon-Salt_Lake_City_Utah.html","Oct 2014 • Family","if you are an avid hiker, you are lucky to have big cottonwood canyon around. there are plenty of well maintained trails around. at the end are silver lake and a number of alpine lakes. in the winter time, it is a great location for skiing."
"https://www.tripadvisor.com/Attraction_Review-g60922-d255182-Reviews-Big_Cottonwood_Canyon-Salt_Lake_City_Utah.html","Big Cottonwood Canyon","C M","Holy scenery batman","https://www.tripadvisor.com/ShowUserReviews-g60922-d255182-r234228232-Big_Cottonwood_Canyon-Salt_Lake_City_Utah.html","Oct 2014 • Business","Great little, narrow and slow drive up to the ski resorts above. The rock formations are amazing and the transition from desert to forest and alpine is breathtaking. This is a must-do trek for visitors."
"https://www.tripadvisor.com/Attraction_Review-g60922-d255182-Reviews-Big_Cottonwood_Canyon-Salt_Lake_City_Utah.html","Big Cottonwood Canyon","ssparkd","Spectacular","https://www.tripadvisor.com/ShowUserReviews-g60922-d255182-r234107186-Big_Cottonwood_Canyon-Salt_Lake_City_Utah.html","Oct 2014 • Couples","Easy drive, lots of pull-offs. Hikes and scenery outstanding. We traveled the Guardsman Pass both ways. Saw a large moose along the way."
"https://www.tripadvisor.com/Attraction_Review-g60922-d255182-Reviews-Big_Cottonwood_Canyon-Salt_Lake_City_Utah.html","Big Cottonwood Canyon","Stephanie S","Hiked Lake Blanche","https://www.tripadvisor.com/ShowUserReviews-g60922-d255182-r234003093-Big_Cottonwood_Canyon-Salt_Lake_City_Utah.html","Oct 2014 • Couples","We hiked Lake Blanche on Friday October 10 and it was perfect! The weather could not have been more gorgeous, and the fall colors were out in full force. All in, this hike took us about 4 hours.... Not gonna lie, it was tough! The first 2-ish hours were uphill, until you get to the lake. We took several stops on the way up, to catch our breath, drink water, and snap photos. The scenery along this hike is breathtaking, one of the most beautiful places I've visited. Once you reach the top, Lake Blanche is equally beautiful - incredibly peaceful and serene. We didn't see many people on the way up (started around 8:15 am), but saw lots of folks on the way down. If you're in reasonable shape, I would 100% do this hike."
"https://www.tripadvisor.com/Attraction_Review-g60922-d255182-Reviews-Big_Cottonwood_Canyon-Salt_Lake_City_Utah.html","Big Cottonwood Canyon","Jeff11382014","Lots of room to explore","https://www.tripadvisor.com/ShowUserReviews-g60922-d255182-r233990685-Big_Cottonwood_Canyon-Salt_Lake_City_Utah.html","Oct 2014 • Couples","I've been here many times and have not even begun to explore all the trails and campsites. There is something here for everyone. Lots of beautiful nature to explore."
"https://www.tripadvisor.com/Attraction_Review-g60922-d255182-Reviews-Big_Cottonwood_Canyon-Salt_Lake_City_Utah.html","Big Cottonwood Canyon","cleoder","Scenic drive","https://www.tripadvisor.com/ShowUserReviews-g60922-d255182-r233767661-Big_Cottonwood_Canyon-Salt_Lake_City_Utah.html","Sep 2014 • Couples","Great rock out crops with high canyon walls as you climb through here going to Park City. Cool spot."
"https://www.tripadvisor.com/Attraction_Review-g60922-d255182-Reviews-Big_Cottonwood_Canyon-Salt_Lake_City_Utah.html","Big Cottonwood Canyon","Runforfunn","Worth the drive","https://www.tripadvisor.com/ShowUserReviews-g60922-d255182-r232245500-Big_Cottonwood_Canyon-Salt_Lake_City_Utah.html","","Unbelievable views as you drive through the canyon. Loved the hike around Silver Lake at the top. We then drove to Park City with even more great views."
"https://www.tripadvisor.com/Attraction_Review-g60922-d255182-Reviews-Big_Cottonwood_Canyon-Salt_Lake_City_Utah.html","Big Cottonwood Canyon","dasb3ar","YES! A MUST!!!","https://www.tripadvisor.com/ShowUserReviews-g60922-d255182-r231649901-Big_Cottonwood_Canyon-Salt_Lake_City_Utah.html","Sep 2014 • Couples","We drove through the canyon during a thunderstorm and it was BREATHTAKING!!! The pouring rain added to the rushing rivers that flowed through the mountain. The fog and storm clouds made the mountain so mystical and romantic. It was breathtaking driving around every bend and turn. During the fall, the trees were changing colors and the forest was incredible! We couldn't help ourselves and had to stop every few minutes or so and snap photos. It was so refreshing being in the storm in the middle of the canyon! Stop by Park City and enjoy a cup of coffee and shop the boutique stores!"
"https://www.tripadvisor.com/Attraction_Review-g60922-d255182-Reviews-Big_Cottonwood_Canyon-Salt_Lake_City_Utah.html","Big Cottonwood Canyon","KThom_3","Breathtaking!","https://www.tripadvisor.com/ShowUserReviews-g60922-d255182-r231616394-Big_Cottonwood_Canyon-Salt_Lake_City_Utah.html","Sep 2014 • Friends","I had a lifetime of an opportunity to take the cable car to the top of The mountain. We were let out to take in the breathtaking scenery at 11,000 feet! I felt as if I could tough the clouds!! It is a must do and take a camera!"
"https://www.tripadvisor.com/Attraction_Review-g60922-d255182-Reviews-Big_Cottonwood_Canyon-Salt_Lake_City_Utah.html","Big Cottonwood Canyon","Suz206","LOVE Big Cottonwood - SPECTACULAR hiking and scenery","https://www.tripadvisor.com/ShowUserReviews-g60922-d255182-r231027369-Big_Cottonwood_Canyon-Salt_Lake_City_Utah.html","Sep 2014 • Friends","loved the hiking and the Silver Fork Lodge is a great place to visit after a hike. Lake Blanche is amazing."
"https://www.tripadvisor.com/Attraction_Review-g60922-d255182-Reviews-Big_Cottonwood_Canyon-Salt_Lake_City_Utah.html","Big Cottonwood Canyon","EJSLC","Big Cottonwood Canyon","https://www.tripadvisor.com/ShowUserReviews-g60922-d255182-r230958445-Big_Cottonwood_Canyon-Salt_Lake_City_Utah.html","Sep 2014 • Family","Amazing scenery, particularly beautiful in the autumn months. Great skiing in the winter. Nice in the summer to get away from the heat."
"https://www.tripadvisor.com/Attraction_Review-g60922-d255182-Reviews-Big_Cottonwood_Canyon-Salt_Lake_City_Utah.html","Big Cottonwood Canyon","aubpgh","Gorgeous","https://www.tripadvisor.com/ShowUserReviews-g60922-d255182-r230873925-Big_Cottonwood_Canyon-Salt_Lake_City_Utah.html","Sep 2014 • Business","Such a beautiful place to visit. Perfect place for taking great pictures of the natural landscape of the area. Will definitely be back again"
"https://www.tripadvisor.com/Attraction_Review-g60922-d255182-Reviews-Big_Cottonwood_Canyon-Salt_Lake_City_Utah.html","Big Cottonwood Canyon","Spencer J","This is a spectacular canyon drive.","https://www.tripadvisor.com/ShowUserReviews-g60922-d255182-r230416050-Big_Cottonwood_Canyon-Salt_Lake_City_Utah.html","Sep 2014 • Family","If you haven't lived in the mountains, or even if you have, this is a great canyon. And there is also little Cottonwood canyon. Very inspiring and awesome. Leading to great Ski Resorts.
The best in the world.
Spence"
"https://www.tripadvisor.com/Attraction_Review-g60922-d255182-Reviews-Big_Cottonwood_Canyon-Salt_Lake_City_Utah.html","Big Cottonwood Canyon","Cobby C","Beautiful place","https://www.tripadvisor.com/ShowUserReviews-g60922-d255182-r229430685-Big_Cottonwood_Canyon-Salt_Lake_City_Utah.html","Sep 2014 • Couples","My wife ran the Big Cottonwood Marathon and couldn't stop gushing about the beauty of the scenery as they ran. The next day we drove up the canyon, stopping at various points to do a little hiking and climbing and take pictures. Definitely something to do when you're in SLC."
"https://www.tripadvisor.com/Attraction_Review-g60922-d255182-Reviews-Big_Cottonwood_Canyon-Salt_Lake_City_Utah.html","Big Cottonwood Canyon","Susan B","Beautiful Photographs","https://www.tripadvisor.com/ShowUserReviews-g60922-d255182-r229027190-Big_Cottonwood_Canyon-Salt_Lake_City_Utah.html","Sep 2014 • Couples","I was with a group of about 200 photographers. We captured some beautiful landscape photos. We took a bus from Salt Lake City from the conference."
"https://www.tripadvisor.com/Attraction_Review-g60922-d255182-Reviews-Big_Cottonwood_Canyon-Salt_Lake_City_Utah.html","Big Cottonwood Canyon","PaulL9","Big Cottonwood Marathon","https://www.tripadvisor.com/ShowUserReviews-g60922-d255182-r228815904-Big_Cottonwood_Canyon-Salt_Lake_City_Utah.html","Sep 2014 • Solo","This canyon was so beautiful. My first trip to Utah will last in my memory because of my time in this canyon."
"https://www.tripadvisor.com/Attraction_Review-g60922-d255182-Reviews-Big_Cottonwood_Canyon-Salt_Lake_City_Utah.html","Big Cottonwood Canyon","Sjennie B","Worth the drive","https://www.tripadvisor.com/ShowUserReviews-g60922-d255182-r228695925-Big_Cottonwood_Canyon-Salt_Lake_City_Utah.html","Sep 2014 • Couples","The Big Cotton Woods Canyon is truly amazing, we pulled over a few times to take pictures of the giant rock mountains. Definitely recommend going there if you like mountains."
"https://www.tripadvisor.com/Attraction_Review-g60922-d255182-Reviews-Big_Cottonwood_Canyon-Salt_Lake_City_Utah.html","Big Cottonwood Canyon","Akkur01","Big Cottonwood Canyod","https://www.tripadvisor.com/ShowUserReviews-g60922-d255182-r228366272-Big_Cottonwood_Canyon-Salt_Lake_City_Utah.html","Sep 2014 • Couples","There is not much to see other than an urban trail very close to a highway. No Canyon at all. We parked near the trail and took a walk along the trail."
"https://www.tripadvisor.com/Attraction_Review-g60922-d255182-Reviews-Big_Cottonwood_Canyon-Salt_Lake_City_Utah.html","Big Cottonwood Canyon","DesertGirl1956","Truly spectacular vistas through Big Cottonwood Canyon. Must see for any mountain lovers.","https://www.tripadvisor.com/ShowUserReviews-g60922-d255182-r227734569-Big_Cottonwood_Canyon-Salt_Lake_City_Utah.html","Aug 2014 • Family","Big Cottonwood Canyon, Little Cottonwood and Wasatch Mountains are what's worth seeing in
Salt Lake City. The sheer beauty of the mountains, the massive rock formations and upward vistas provide stunning viewing around each bend. Many trails for hiking, rock climbing or just getting off the road into the forest. Skip the man-made architechure of Temple Square and drive through Big Cottonwood Canyon to see the real thing!"
"https://www.tripadvisor.com/Attraction_Review-g60922-d255182-Reviews-Big_Cottonwood_Canyon-Salt_Lake_City_Utah.html","Big Cottonwood Canyon","Nana2B2","Great nature trip","https://www.tripadvisor.com/ShowUserReviews-g60922-d255182-r227347443-Big_Cottonwood_Canyon-Salt_Lake_City_Utah.html","Oct 2013 • Couples","I love the 'S' curve on this road to stop and take a short walk to a spot that is just down from the road but gets you really close to the creek. Level and great for all ages and abilities. Silverlake at the top of the canyon is also a great place for families to picnic, hike, enjoy the view."
"https://www.tripadvisor.com/Attraction_Review-g60922-d255182-Reviews-Big_Cottonwood_Canyon-Salt_Lake_City_Utah.html","Big Cottonwood Canyon","AnninSLC","Fall Drive","https://www.tripadvisor.com/ShowUserReviews-g60922-d255182-r226495130-Big_Cottonwood_Canyon-Salt_Lake_City_Utah.html","Oct 2013 • Friends","If you want to see fall colors and spectacular mountains, maybe some wild life try this drive. Be careful - drive slowly, enjoy the beauty and don't come to close to the many cyclists who will be enjoying the canyon road with you."
"https://www.tripadvisor.com/Attraction_Review-g60922-d255182-Reviews-Big_Cottonwood_Canyon-Salt_Lake_City_Utah.html","Big Cottonwood Canyon","AnaBaile","How did we miss this all these years? Easy hike and quite renewing experience.","https://www.tripadvisor.com/ShowUserReviews-g60922-d255182-r225353076-Big_Cottonwood_Canyon-Salt_Lake_City_Utah.html","Aug 2014 • Friends","I guess we were a bit ""snobbish"" about our outdoor experiences after living in northwest Montana for many years; although we have found wonderful sights and adventures in Utah. It always seemed that the hikes near Salt Lake City were overused and underwhelming. Although Big Cottonwood Canyon is a busy place, a group of friends hiked up to Lake Solitude last week and found, well, solitude. And no mosquitoes. The trail starts at the Silver Lake center (restrooms available) and is a pretty easy 1.5 mile hike up to a small, yet pretty lake. Anyone (almost, there is a somewhat steep short portion just before arriving at the lake) could do this easy trail. I recommend it for a little morning getaway. We headed up the trail around 10 a.m. We only saw a very few people on our way up, then had the lake to ourselves for about 20 minutes. On our way back down the trail we passed quite a few people as they ventured up. Now I regret not doing more cerca-City exploring over the years. It was really a delightful morning."
"https://www.tripadvisor.com/Attraction_Review-g60922-d255182-Reviews-Big_Cottonwood_Canyon-Salt_Lake_City_Utah.html","Big Cottonwood Canyon","IslandGuy376","Scenic But Not Visitor Friendly","https://www.tripadvisor.com/ShowUserReviews-g60922-d255182-r225017507-Big_Cottonwood_Canyon-Salt_Lake_City_Utah.html","Aug 2014 • Couples","I read about hiking/walking trails but there was no apparent welcome station or anything else that would guide you to the various walks. We also saw signs that indicated dogs were not welcome. Get some proper water treatment and get over it Salt Lake. All animals poop in the wild and while we bag ours, most of the wildlife doesn't."
"https://www.tripadvisor.com/Attraction_Review-g60922-d255182-Reviews-Big_Cottonwood_Canyon-Salt_Lake_City_Utah.html","Big Cottonwood Canyon","YvieLeeds_","Great city getaway","https://www.tripadvisor.com/ShowUserReviews-g60922-d255182-r224913467-Big_Cottonwood_Canyon-Salt_Lake_City_Utah.html","Aug 2014 • Family","We had a fabulous day with our two boys here. Very beautiful areas with quite a lot of wildlife to see. We were so disappointed however that when we arrived at silver lake we just missed out on the moose which had been sunbathing for more than an hour. Some people told us that it went into the bushes just before we arrived. It was still a lovely place to visit and the walk through the trees from solitude to silver lake as it was really peaceful as there were hardly any people around. The drive through the canyon was beautiful and only 20 mins drive from the hustle and bustle of the city."
"https://www.tripadvisor.com/Attraction_Review-g60922-d255182-Reviews-Big_Cottonwood_Canyon-Salt_Lake_City_Utah.html","Big Cottonwood Canyon","Rather_Nomadic","Scenic drive for lots of hiking options","https://www.tripadvisor.com/ShowUserReviews-g60922-d255182-r224586626-Big_Cottonwood_Canyon-Salt_Lake_City_Utah.html","Aug 2014 • Solo","I used Big Cottonwood Canyon road to access the Silver Lake hiking area up by Brighton Ski Resort. There is plenty of parking near the Silver Lake visitor center and you can use that trail to access Twin Lakes and Lake Solitude hikes as well. Silver Lake visitor center has restrooms, trashcans and water. Great half day adventure from Salt Lake City proper. Even with kids, the Silver Lake loop is relatively flat and fine for strollers."
"https://www.tripadvisor.com/Attraction_Review-g60922-d255182-Reviews-Big_Cottonwood_Canyon-Salt_Lake_City_Utah.html","Big Cottonwood Canyon","drillerboy","a scenic drive","https://www.tripadvisor.com/ShowUserReviews-g60922-d255182-r223959818-Big_Cottonwood_Canyon-Salt_Lake_City_Utah.html","Aug 2014 • Couples","We just had a couple hours to kill so we drove up to the Solitude Ski area, it was a very scenic drive, and a lot of cyclists were making the climb on a good shoulder. We would like to go back for a hike sometime"
"https://www.tripadvisor.com/Attraction_Review-g60922-d255182-Reviews-Big_Cottonwood_Canyon-Salt_Lake_City_Utah.html","Big Cottonwood Canyon","Ricardo35","What a treat!","https://www.tripadvisor.com/ShowUserReviews-g60922-d255182-r222934229-Big_Cottonwood_Canyon-Salt_Lake_City_Utah.html","Aug 2014 • Family","The canyon is beautiful, pleasant temperature of 70F during August. There a lot of picnic areas, creeks and green areas for nature's lovers. Early in the morning is less crowded than afternoons.
Several hiking trails, one better than the other...a must see canyon!"
"https://www.tripadvisor.com/Attraction_Review-g60922-d255182-Reviews-Big_Cottonwood_Canyon-Salt_Lake_City_Utah.html","Big Cottonwood Canyon","Dan R","As if Big Cottonwood were just one thing. . .","https://www.tripadvisor.com/ShowUserReviews-g60922-d255182-r222545153-Big_Cottonwood_Canyon-Salt_Lake_City_Utah.html","Aug 2014 • Family","Are you coming skiing, summer sporting, picnicking, hiking, snowshoeing, concert going. . .
A bit meaningless to write a general review, but Big Cottonwood pretty much gets 5 stars on all the above. I haven't done a lot of the trails yet, but Lake Blanche was outstanding."
"https://www.tripadvisor.com/Attraction_Review-g60922-d255182-Reviews-Big_Cottonwood_Canyon-Salt_Lake_City_Utah.html","Big Cottonwood Canyon","Stolen Buick","Close to City - Easy Drive - All levels of Access","https://www.tripadvisor.com/ShowUserReviews-g60922-d255182-r222211557-Big_Cottonwood_Canyon-Salt_Lake_City_Utah.html","Aug 2014 • Couples","Very close to the city and an essay trip if you are visiting. The drive itself is about 30 minutes and is a very beautiful, canyon and mountain drive with lots of places to pull over, view, hike, picnic, etc. (I visited in August but it is a four season wonder). We drove about 12 miles in to the lake and did both the board walk hike which is short and east for anyone and is accessible so perfect for kids, seniors or whatever – and has awesome views of the lake and mountains! If you are more of a hiker, there are a many wonderful trails with vistas and views. Just a great experience overall and not to be missed if you are visiting SLC!"
"https://www.tripadvisor.com/Attraction_Review-g60922-d255182-Reviews-Big_Cottonwood_Canyon-Salt_Lake_City_Utah.html","Big Cottonwood Canyon","LASocialWorket","Pretty drive","https://www.tripadvisor.com/ShowUserReviews-g60922-d255182-r220268528-Big_Cottonwood_Canyon-Salt_Lake_City_Utah.html","Jul 2014 • Family","Mill D North a Fork Trail is a must see and do. Easy walk around Silver Lake, beautiful setting, and great opportunity to see wildlife."
"https://www.tripadvisor.com/Attraction_Review-g60922-d255182-Reviews-Big_Cottonwood_Canyon-Salt_Lake_City_Utah.html","Big Cottonwood Canyon","Tim F","Beautiful!","https://www.tripadvisor.com/ShowUserReviews-g60922-d255182-r219820644-Big_Cottonwood_Canyon-Salt_Lake_City_Utah.html","Jun 2014 • Family","We try and go up this canyon once a week. There are many trails, rivers, lakes, and wildlife to see and enjoy."
"https://www.tripadvisor.com/Attraction_Review-g60922-d255182-Reviews-Big_Cottonwood_Canyon-Salt_Lake_City_Utah.html","Big Cottonwood Canyon","Anonymous1366","Not to be missed for its scenic highway, challenging hikes, and towering canyon walls amid the aspens.","https://www.tripadvisor.com/ShowUserReviews-g60922-d255182-r219808573-Big_Cottonwood_Canyon-Salt_Lake_City_Utah.html","Aug 2014 • Friends","Lots of traffic on this highway can be challenging, and frustrating. But go early, and plan a hike or at least a walk around Silver Lake up near Brighton."
"https://www.tripadvisor.com/Attraction_Review-g60922-d255182-Reviews-Big_Cottonwood_Canyon-Salt_Lake_City_Utah.html","Big Cottonwood Canyon","awilk7","Emerald Escape","https://www.tripadvisor.com/ShowUserReviews-g60922-d255182-r219785175-Big_Cottonwood_Canyon-Salt_Lake_City_Utah.html","Jun 2014 • Family","Big Cottonwood is a great escape from the urban Wasatch Front, both winter and summer. In 10 minutes, you can be off of I-215 and into a rugged, mountainous chasm on the way to waterfalls, woods, and alpine lakes and peaks.
Besides the obvious (skiing), I've enjoyed sport climbing, hiking, snowshoeing, camping, scrambling, and picnicking in Big Cottonwood. It is a great place for all of the above.
Parking is either excellent or challenging, depending upon the crowds and where you plan to go (Silver Lake Trailhead: easy, S-Curve Trailhead: tougher on a busy summer day unless you get there early).
Lake Blanche is a prototypical alpine lake: clear, beautiful water with wildflowers below and craggy peaks above. The lake is a great place to start if you are wanting to delve deeper into the Wasatch Range, away from the roads and ski resorts."
"https://www.tripadvisor.com/Attraction_Review-g60922-d255182-Reviews-Big_Cottonwood_Canyon-Salt_Lake_City_Utah.html","Big Cottonwood Canyon","princespoison","mARY, mARTHA AND cATHRINE!!!","https://www.tripadvisor.com/ShowUserReviews-g60922-d255182-r218832130-Big_Cottonwood_Canyon-Salt_Lake_City_Utah.html","Jun 2014 • Family","Silver lake is a fantastic little lake that is easily accessible and 30 to walk around the whole lake but for the hikers its all about the Sisters. Yes, there is several all over the top of Big Cottonwood Canyon but as a pro photographer Mary's lake is not to bad of a hike with newer, easier trails and the landscape in and around Mary's Lake is awesome and good for cliff jumping too. Martha and Cathrine are for the die-hard's because once you get to Mary's its hard to leave it but please do yourself a favor and press on, its worth it.
For a easier way to see the sisters, go up Little Cottonwood Canyon, go to Albien Basin and you'll find Cathrine pass... going downhill the whole time makes it easier for the younger or inexperienced ones. Bring lots of water or a filter for the lakes. Its a water shed area, leave the dogs at home."
"https://www.tripadvisor.com/Attraction_Review-g60922-d255182-Reviews-Big_Cottonwood_Canyon-Salt_Lake_City_Utah.html","Big Cottonwood Canyon","French S","One beautiful drive","https://www.tripadvisor.com/ShowUserReviews-g60922-d255182-r218119880-Big_Cottonwood_Canyon-Salt_Lake_City_Utah.html","Jul 2014 • Couples","We love to drive thru Big Cottonwood Canyon going back to Deer Valley. Gorgeous views of the canyon and wildlife sightings are a plus."
"https://www.tripadvisor.com/Attraction_Review-g60922-d255182-Reviews-Big_Cottonwood_Canyon-Salt_Lake_City_Utah.html","Big Cottonwood Canyon","BKSNtravel","Beautiful in the summer and great hiking","https://www.tripadvisor.com/ShowUserReviews-g60922-d255182-r217582747-Big_Cottonwood_Canyon-Salt_Lake_City_Utah.html","","The canyon drive is breathtaking. Watch out for many sports enthusiasts - lots of bikers and runners. We hiked two trails. Dog Lake was a peaceful hike with amazing wildflowers. When we were about .5 miles from the lake the misquotes were all over us. Bring bug spray for this hike. Also the last .5 miles is a steep climb. We also hiked Willow Heights. Perfect hike with young kids. There are ducks at the lake. We were the only people at the lake it was incredible peaceful."
"https://www.tripadvisor.com/Attraction_Review-g60922-d255182-Reviews-Big_Cottonwood_Canyon-Salt_Lake_City_Utah.html","Big Cottonwood Canyon","Sekou R","Breathtaking","https://www.tripadvisor.com/ShowUserReviews-g60922-d255182-r216592598-Big_Cottonwood_Canyon-Salt_Lake_City_Utah.html","Jul 2014 • Solo","If you have the time make it up Big Cottonwood. I took a morning and drove up there solo. The granite cliffs, lush greenery, and cascading streams made it all worth it. Take your time going up, there are a lot of twists and turns. What a view!!"
"https://www.tripadvisor.com/Attraction_Review-g60922-d255182-Reviews-Big_Cottonwood_Canyon-Salt_Lake_City_Utah.html","Big Cottonwood Canyon","NoelsCat","Trip advisors address listing is wrong… GPS warning","https://www.tripadvisor.com/ShowUserReviews-g60922-d255182-r216158467-Big_Cottonwood_Canyon-Salt_Lake_City_Utah.html","Jul 2014 • Family","This is actually a beautiful place --- when we ended up getting there. One word of caution: DO NOT USE THE ADDRESS LISTED IN THIS TRIP ADVISOR (3872 S. Swallow) as it is wrong. Unfortunately, I did and spent over an hour and a half driving around in the heat."
